nombre,tipo,caracteristicas,detalles,imagen,web_link,categoria,descripcion
"Geomembranas Poliméricas (HDPE, LLDPE)","Sistemas Avanzados de Impermeabilización","Revestimientos sintéticos de muy baja permeabilidad, alta resistencia química (ácidos, álcalis, solventes) y UV, durabilidad (50+ años). Disponibles en varios espesores (1.0-3.0 mm) y texturas para estabilidad en taludes. [1, 2]","La selección del espesor (típicamente 1.5-2.5 mm para barreras primarias [3]) depende de la carga, sustrato y química de relaves. Aditivos mejoran resistencia UV y oxidación. La calidad de instalación y soldaduras es crucial. Solmax GSE HD excede GRI-GM13..[1, 2, 4] Aptas hasta 60°C; para mayores temperaturas, se requieren alternativas (GSE HDH).[3] Aunque efectivas solas, la tendencia es hacia sistemas compuestos con GCLs para mayor seguridad, especialmente en TSFs de alto riesgo, ofreciendo redundancia..[3, 5] La compatibilidad química es vital y requiere caracterización detallada de relaves y pruebas de inmersión para ambientes agresivos..[2, 3, 4] El costo inicial debe evaluarse frente al costo del ciclo de vida y la reducción de riesgos..[6, 2]","Rollos de geomembrana HDPE y sección de TSF con revestimiento.","[bpmgeomembrane.com](https://www.bpmgeomembrane.com), [solmax.com](https://www.solmax.com), [atarfil.com](https://www.atarfil.com), [agruamerica.com](https://www.agruamerica.com), [bpmgeosynthetics.com](https://www.bpmgeosynthetics.com)","Prevención y Control en la Fuente","Barreras sintéticas impermeables para contener lixiviados de relaves y prevenir la contaminación del subsuelo."
"Revestimientos de Arcilla Geosintética (GCLs)","Sistemas Avanzados de Impermeabilización","Compuestos de bentonita de sodio (alta capacidad de hinchamiento, baja permeabilidad) entre dos geotextiles. Autosellantes y autoreparantes. [7, 8]","La bentonita en polvo asegura hidratación y sellado. Variedades con recubrimiento de PE (e.g., Bentofix® X Series) mejoran resistencia a desecación, intercambio iónico, gases y erosión; previenen tuberización y actúan como barrera de raíces..[7, 9] Alternativa económica y de rápida instalación a arcillas compactadas. Bentofix® X ofrece dos barreras de sellado..[7, 8, 9] La combinación con geomembranas en sistemas compuestos es una práctica creciente para maximizar la seguridad..[5]","Diagrama de GCL (capas de geotextil y bentonita) y variante con recubrimiento PE.","[globalsynthetics.com.au](https://globalsynthetics.com.au), [titanenviro.com](https://www.titanenviro.com), [naue.com](https://www.naue.com), [geoquest-group.com.au](https://www.geoquest-group.com.au), [texofib.com](https://www.texofib.com)","Prevención y Control en la Fuente","Barreras compuestas de bentonita y geotextiles para impermeabilizar depósitos de relaves, con capacidad de autosellado."
"Revestimientos Compuestos (Geomembrana + GCL/Arcilla Compactada)","Sistemas Avanzados de Impermeabilización","Combinación de geomembranas con GCLs o capas de arcilla compactada (CCL) para un sistema de barrera redundante y robusto. [5]","Aprovechan ventajas de ambos materiales: muy baja permeabilidad y mayor resistencia a daños. Sistemas de un solo compuesto (geomembrana sobre suelo compactado) para baja carga hidráulica..[3] Investigación en transmisividad de interfaz GCL-HDPE para compatibilidad..[5] Considerados el estándar de oro para TSFs de alto riesgo por su redundancia y seguridad mejorada contra infiltración..[3, 5]","Esquema de revestimiento compuesto (geomembrana sobre GCL o CCL).","(Inferido de fuentes de geomembranas y GCLs)","Prevención y Control en la Fuente","Sistemas de impermeabilización multicapa que combinan las propiedades de las geomembranas y las arcillas (naturales o geosintéticas) para una máxima contención."
"Relaves Espesados y en Pasta (Thickened and Paste Tailings)","Métodos de Deshidratación de Relaves y Disposición Alternativa","Aumento de la densidad de sólidos. Espesados: lodo denso. Pasta: material no segregante, mínima agua, no fluye fácilmente. [10, 11, 12, 13, 14, 15]","Espesadores (Metso, FLSmidth) recuperan agua (hasta 70% [15]) antes de deposición..[12, 14, 15] Pasta puede bombearse o usarse en relleno subterráneo (backfill) con cemento..[11, 12, 15] Disposición en superficie: Descarga Central Espesada (CTD) o Descarga en Valle (DV)..[13, 16] Beneficios: menor huella TSF, menor riesgo falla (menos agua libre), menor infiltración, recuperación agua, menor altura terraplenes, mejor estabilidad sísmica, fácil cierre..[10, 11, 12, 13] Metso y FLSmidth proveen soluciones. La reducción de agua es un paradigma dominante para mitigar riesgos..[17, 12]","Diagrama de sistema CTD o planta de pasta Metso.","[metso.com](https://www.metso.com), [atcwilliams.com](https://www.atcwilliams.com), [geotails.com.au](https://www.geotails.com.au), [ketos.co](https://www.ketos.co), [flsmidth.com](https://flsmidth.com)","Prevención y Control en la Fuente","Tecnologías para reducir el contenido de agua en los relaves antes de su disposición, mejorando la estabilidad y reduciendo la infiltración."
"Co-disposición de Relaves y Estériles de Mina (Co-disposal)","Métodos de Deshidratación de Relaves y Disposición Alternativa","Mezcla de relaves finos con roca estéril gruesa para un solo flujo de residuos. Mejora estabilidad geotécnica y geoquímica. [11, 22, 23, 24]","Incrementa estabilidad física (resistencia al corte, reduce licuefacción) y química (limita O2 y agua, reduce DRAM si relaves saturan vacíos)..[23, 24] Métodos: bombeo conjunto, roca en pasta, capas, inyección..[23, 25] FLSmidth EcoTails® es una forma..[21] SRK Consulting destaca beneficios..[24] Ventajas: evita costos presa, ahorra espacio, reduce costos cierre..[23] Desafíos: control mezcla, logística, posible nivel freático elevado..[23] Solución sinérgica para residuos múltiples, optimizando espacio y estabilidad..[21, 23, 24]","Diagrama de métodos de co-disposición o GeoWaste™ de FLSmidth.","[mineclosure.gtk.fi](https://mineclosure.gtk.fi), [geotails.com.au](https://www.geotails.com.au), [mdpi.com](https://www.mdpi.com), [srk.com](https://www.srk.com), [tailings.info](https://www.tailings.info)","Prevención y Control en la Fuente","Técnica que combina relaves y roca estéril para mejorar la estabilidad física y química del depósito de residuos."
"Cortinas de Inyección (Grout Curtains)","Barreras Subterráneas (Cutoff Walls)","Barreras impermeables creadas inyectando lechada (cemento, bentonita, poliuretano) en el subsuelo para sellar fracturas/poros. [34, 37, 38, 39]","Poliuretano (Terra-Lok™, Terrathane™ de NCFI) crea sello hermético para presas, túneles, contención ambiental..[37, 38] Se inyecta y expande formando barrera continua..[39] Instalación no invasiva, duradera..[39] Usadas en infraestructura crítica, control agua subterránea, contención contaminantes..[37, 38] La longevidad y mantenimiento son factores críticos a considerar.","Ilustración de inyección de lechada bajo una presa.","[barwellsolutions.com](https://www.barwellsolutions.com), [researchgate.net](https://www.researchgate.net), [groundworks.com](https://www.groundworks.com), [ncfigeo.com](https://www.ncfigeo.com)","Contención e Intercepción","Barreras formadas por la inyección de materiales sellantes en el subsuelo para reducir su permeabilidad y controlar el flujo de contaminantes."
"Bombeo para Control de Gradiente Hidráulico","Contención Hidráulica (Hydraulic Containment)","Utiliza bombeo de agua subterránea (pozos o trincheras/drenes de intercepción) para controlar el gradiente hidráulico y la migración de contaminantes. [40]","Pozos de bombeo crean cono de depresión que atrae pluma. Trincheras interceptan flujo somero; agua bombeada se trata/dispone..[40] Requiere conocimiento hidrogeológico detallado (modelado), a menudo escala piloto inicial..[40] Agua extraída debe ser tratada (ver P&T)..[40, 41, 42] Es un control activo con consumo energético y tratamiento continuo..[40, 41] Requiere diseño dinámico y adaptativo..[40]","Diagrama de sistema de bombeo y tratamiento para contención de pluma.","[gost.tpsgc-pwgsc.gc.ca](https://gost.tpsgc-pwgsc.gc.ca)","Contención e Intercepción","Sistema que utiliza pozos de bombeo para extraer agua subterránea contaminada, creando una barrera hidráulica que previene la expansión de la pluma."
"Barreras Reactivas Permeables (PRBs)","Métodos de Tratamiento In-Situ","Zonas de tratamiento in-situ que capturan pasivamente pluma de contaminantes y los eliminan/descomponen. Permiten flujo de agua a través de medio reactivo. [43, 44, 45]","Materiales: ZVI (metales pesados Cr, As, U; solventes clorados) [43, 45, 46]; compost/orgánico y caliza (AMD, sulfatos, promueve SRB).[44, 45, 46] Otros: zeolitas, apatita. Ventajas: costos reducidos, bajo consumo energía..[44] Limitaciones: clogging, armouring, longevidad incierta..[44] Hepure Ferox PRB® ZVI..[47] Geo-Solutions (ZVI PRBs)..[48] Muchos sistemas dependen de la sinergia entre procesos abióticos y bióticos..[44, 46, 49]","Diagrama de PRB (zanja continua o funnel-and-gate).","[en.wikipedia.org](https://en.wikipedia.org), [core.ac.uk](https://core.ac.uk), [clu-in.org](https://clu-in.org), [researchgate.net](https://www.researchgate.net), [hepure.com](https://www.hepure.com), [geo-solutions.com](https://www.geo-solutions.com)","Remediación In-Situ","Zanjas o zonas subterráneas rellenadas con materiales reactivos que tratan el agua contaminada a medida que fluye a través de ellas."
"Oxidación Química In-Situ (ISCO)","Métodos de Tratamiento In-Situ","Inyección de oxidantes químicos fuertes (permanganato, persulfato, H2O2 catalizado, ozono) para destruir contaminantes orgánicos. [50, 51]","Efectiva para solventes clorados, fenoles, PAHs, TPHs, algunos explosivos..[51] Elección de oxidante depende de contaminante/sitio. Carus RemOx® S/L..[51] Desafíos: distribución uniforme, NOD, seguridad..[50, 51] Puede requerir múltiples inyecciones..[50, 51]","Esquema de inyección de oxidantes en pluma de contaminación.","[serdp-estcp.mil](https://serdp-estcp.mil), [carusllc.com](https://www.carusllc.com)","Remediación In-Situ","Técnica que introduce oxidantes químicos en el subsuelo para degradar contaminantes orgánicos."
"Reducción Química In-Situ (ISCR)","Métodos de Tratamiento In-Situ","Colocación de material reductor para degradar orgánicos tóxicos, inmovilizar metales (Cr(VI)) y degradar oxianiones. [49, 52]","Reductores: ZVI, hierro ferroso, ditionito de sodio, sales de sulfuro (polisulfuro de calcio)..[49, 52] ISRM: usa reductores para activar hierro nativo..[49] Polisulfuro de Ca precipita cationes como sulfuros..[52] Combinación con enmiendas biológicas es efectiva..[49] Evaluar estabilidad metales precipitados..[52]","Diagrama de inyección de agente reductor.","[clu-in.org](https://clu-in.org), [enviro.wiki](https://www.enviro.wiki)","Remediación In-Situ","Técnica que introduce agentes reductores en el subsuelo para transformar contaminantes a formas menos tóxicas o inmóviles."
"Biorremediación Anaeróbica con SRB","Métodos de Tratamiento In-Situ","Uso de bacterias sulfato-reductoras (SRB) para reducir sulfato a sulfuro, precipitando metales como sulfuros insolubles y aumentando pH. [53, 54]","Rentable para AMD. Biorreactores SRB: alta reducción sulfato (hasta 93.97%), recuperación metales (hasta 99% Zn)..[53] Fuentes de C: glicerol, etanol, residuos orgánicos..[53] Desafíos: condiciones óptimas, H2S tóxico, escalabilidad..[53] Avances: ingeniería genética SRB, integración tecnologías..[53] S⁰RB también prometedoras..[54]","Esquema de biorreactor SRB o precipitación de metales.","[mdpi.com](https://www.mdpi.com), [researchgate.net](https://www.researchgate.net), [wsp.com](https://www.wsp.com), [olympianwatertesting.com](https://olympianwatertesting.com)","Remediación In-Situ","Utilización de microorganismos, especialmente bacterias sulfato-reductoras, para tratar AMD y precipitar metales pesados."
"Fitorremediación","Métodos de Tratamiento In-Situ","Uso de plantas para extraer (fitoextracción) o inmovilizar/estabilizar (fitoestabilización) contaminantes (metales) en suelos/relaves. [55, 56]","Fitoextracción: translocación metales a biomasa aérea y cosecha. Fitoestabilización: cubierta vegetal inmoviliza metales en zona radicular..[55] Limitaciones: bajas tasas remoción (fitoextracción); conocimiento enmiendas (fitoestabilización)..[55] Plantas nativas prometedoras..[55] ""Cap and plant"" común..[56] PGPB mitigan estrés..[55]","Plantas creciendo sobre relaves, ilustrando fitoestabilización.","[researchgate.net](https://www.researchgate.net), [superfund.arizona.edu](https://superfund.arizona.edu)","Remediación In-Situ","Uso de plantas para remover, degradar o estabilizar contaminantes en el suelo y agua, incluyendo metales de relaves."
"Nanorremediación","Métodos de Tratamiento In-Situ","Uso de nanopartículas (1-100 nm) (nZVI, carbono, óxidos metálicos) para tratar agua subterránea. [57, 58]","Mecanismos: reducción química (nZVI reduce Cr(VI)), adsorción (nanotubos C adsorben metales), catálisis..[57] Ventajas: alta eficiencia, tratamiento dirigido, menor impacto ambiental, in-situ, rentable a largo plazo..[57] nZVI efectivo para Pb, Cd, Hg, As..[57, 58] Limitaciones: impacto ambiental NP a largo plazo, costo producción, regulación..[57] Hepure y Hongwu son proveedores de nZVI..[59, 60] Prometedora pero con interrogantes ambientales..[57]","Ilustración de nanopartículas interactuando con contaminantes.","[genviss.in](https://genviss.in), [researchgate.net](https://www.researchgate.net), [hepure.com](https://www.hepure.com), [hwnanoparticles.com](https://www.hwnanoparticles.com)","Remediación In-Situ","Aplicación de nanopartículas reactivas para degradar o inmovilizar contaminantes directamente en el acuífero."
"Atenuación Natural Monitoreada (MNA)","Métodos de Tratamiento In-Situ","Confianza en procesos naturales (físicos, químicos, biológicos) para disminuir contaminantes, con monitoreo. [61, 62]","Procesos: sorción, dilución, evaporación, biodegradación, degradación química/abiótica, advección, dispersión..[61, 62] Mejor si fuente eliminada..[61] Requiere condiciones adecuadas, monitoreo. Larga duración (años-décadas)..[61] Evaluar tendencias históricas, datos geoquímicos, estudios microcosmos..[62]","Gráfico de disminución de contaminantes por atenuación natural.","[des.sc.gov](https://des.sc.gov), [frtr.gov](https://frtr.gov)","Remediación In-Situ","Estrategia de remediación que se basa en procesos naturales para reducir la concentración de contaminantes, con monitoreo continuo."
"Remediación Electrocinética","Métodos de Tratamiento In-Situ","Aplicación de corriente eléctrica directa de bajo nivel para movilizar contaminantes (electromigración, electroósmosis, electroforesis) hacia electrodos. [63, 64]","Efectiva para metales, aniones, orgánicos en suelos de baja permeabilidad/heterogéneos..[64] Puede combinarse con biorremediación o PRBs..[64] Electromigración efectiva para iones de metales pesados..[64]","Diagrama de sistema de remediación electrocinética.","[epa.gov](https://www.epa.gov), [waterlyst.com](https://www.waterlyst.com)","Remediación In-Situ","Técnica que utiliza campos eléctricos para mover y extraer contaminantes del subsuelo."
"Bombeo y Tratamiento (Pump and Treat - P&T)","Métodos de Tratamiento Ex-Situ","Extracción de agua subterránea contaminada y tratamiento en superficie. [40, 41, 42]","Tratamiento puede ser simple (carbón activado, air stripping) o múltiple..[41] Agua tratada se descarga/reutiliza. Residuos (lodos, filtros) requieren disposición..[41] Duración: años a décadas..[41] ESD Wast2Water fabrica sistemas..[42] A menudo se requiere un tren de tratamiento para efluentes complejos..[41, 65]","Diagrama de sistema P&T con pozos y planta de tratamiento.","[epa.gov](https://www.epa.gov), [waste2water.com](https://www.waste2water.com), [gost.tpsgc-pwgsc.gc.ca](https://gost.tpsgc-pwgsc.gc.ca)","Remediación Ex-Situ","Método que extrae agua subterránea contaminada para tratarla en la superficie antes de su descarga o reutilización."
"Procesos de Oxidación Avanzada (POA) Ex-Situ","Métodos de Tratamiento Ex-Situ","Uso de radicales hidroxilo (•OH) u otros oxidantes fuertes para mineralizar/transformar contaminantes orgánicos. [66, 67]","Tipos: O3/UV, O3/H2O2, UV/H2O2, Fenton, fotocatálisis (UV/TiO2), electroquímicos..[66, 67] Efectivos para contaminantes persistentes..[67] CTET (UNSW) desarrolla POA para aguas de minería (alta salinidad, orgánicos refractarios)..[66] Veolia (UV, O3, H2O2)..[68] ZnO-BiOI para cianuro..[69] La gestión de residuos secundarios es un desafío..[41, 70, 71]","Esquema de reactor POA (e.g., UV/H2O2).","[unsw.edu.au](https://www.unsw.edu.au), [trityenviro.com](https://www.trityenviro.com), [watertechnologies.com](https://www.watertechnologies.com), [mdpi.com](https://www.mdpi.com)","Remediación Ex-Situ","Tecnologías que utilizan oxidantes potentes (como radicales hidroxilo) generados en superficie para degradar contaminantes en el agua extraída."
"Precipitación Química","Métodos de Tratamiento Ex-Situ","Adición de químicos para formar precipitados sólidos de contaminantes (metales pesados) que se separan del agua. [71, 72]","Cal (Ca(OH)2) o sulfuros (Na2S) para precipitar hidróxidos o sulfuros metálicos..[70, 71] Control pH crucial..[71] Genera lodos..[71] Aplicable a aguas residuales de minería..[71] Kiewit y Veolia (MetClear*) ofrecen soluciones..[73, 74] El balance costo-eficiencia es clave..[67, 75]","Tanques de mezcla y sedimentación para precipitación química.","[krakensense.com](https://krakensense.com), [longdom.org](https://www.longdom.org), [frtr.gov](https://frtr.gov), [kiewit.com](https://www.kiewit.com), [watertechnologies.com](https://www.watertechnologies.com)","Remediación Ex-Situ","Proceso que elimina metales pesados y otros contaminantes del agua mediante la adición de químicos que los hacen insolubles y precipitan."
"Intercambio Iónico","Métodos de Tratamiento Ex-Situ","Eliminación de iones tóxicos por intercambio con iones inocuos en resina sintética, arcillas, zeolitas. [70, 72, 76]","Resinas selectivas. Reversible, resinas regenerables (genera flujo residuo 2-10%)..[70] Límite influyente ~2,000 mg/L..[70] Felitecn (resinas catiónicas/quelantes para metales pesados)..[76] LANXESS (Lewatit®)..[77] ProSep Ltd..[78]","Columnas de intercambio iónico en planta de tratamiento.","[krakensense.com](https://krakensense.com), [frtr.gov](https://frtr.gov), [felitecn.com](https://www.felitecn.com), [lanxess.com](https://www.lanxess.com), [prosep-ltd.com](https://www.prosep-ltd.com)","Remediación Ex-Situ","Tecnología que utiliza resinas especiales para intercambiar iones contaminantes en el agua por iones inofensivos."
"Ósmosis Inversa (RO)","Métodos de Tratamiento Ex-Situ","Purificación con membrana semipermeable para eliminar iones, moléculas, partículas mediante presión. [65, 72, 75]","Elimina hasta 99% sales disueltas, partículas, coloides, orgánicos..[75] Permite reciclaje agua. Requiere pretratamiento (evitar fouling)..[65, 75] Costo inicial alto, beneficios a largo plazo..[75] AMPAC USA, Pure Aqua, Newterra ofrecen sistemas..[75, 79, 80] FO como pretratamiento para RO..[65]","Módulos de membranas RO en skid de tratamiento.","[krakensense.com](https://krakensense.com), [ampac1.com](https://www.ampac1.com), [acarp.com.au](https://www.acarp.com.au), [pureaqua.com](https://www.pureaqua.com), [newterra.com](https://www.newterra.com)","Remediación Ex-Situ","Proceso de filtración por membrana que elimina una amplia gama de contaminantes disueltos del agua bajo presión."
"Tomografía de Resistividad Eléctrica (ERT)","Métodos Geofísicos","Mide distribución espacial de resistividad eléctrica. Zonas saturadas/contaminadas (conductivas) suelen tener baja resistividad. [81, 82, 83, 84]","Caracterización sitios, detección infiltración/fugas en presas, contenido humedad..[32, 81, 83, 84] Mapeo plumas contaminantes..[82, 85] Ventajas: seguro, rápido, rentable vs invasivos..[84] HGI (ERT para lixiviación)..[84] Usada en minería para detectar túneles/cavidades..[86] La geofísica evoluciona hacia monitoreo proactivo..[81, 83, 84]","Perfil de resistividad 2D mostrando anomalía de baja resistividad.","[parsan.biz](https://www.parsan.biz), [researchgate.net](https://www.researchgate.net), [agu.confex.com](https://agu.confex.com), [hgiworld.com](https://www.hgiworld.com), [mdpi.com](https://www.mdpi.com), [clu-in.org](https://clu-in.org)","Monitoreo y Detección","Técnica geofísica que mapea la resistividad eléctrica del subsuelo para detectar zonas de infiltración y plumas de contaminación."
"Polarización Inducida (IP)","Métodos Geofísicos","Mide capacidad de materiales subsuelo para almacenar/liberar carga eléctrica (cargabilidad). Sensible a sulfuros diseminados y arcillas. [81, 87, 88]","Mapeo contaminación por relaves sulfurosos, halos alteración, variaciones agua subterránea..[87, 88] Diferencia zonas mineralizadas de roca encajante..[87] Usada en exploración minera y evaluaciones ambientales..[87, 88] Superficie o sondeos..[88, 89, 90] La integración de múltiples métodos geofísicos es clave..[81, 91]","Mapa de cargabilidad mostrando anomalía de sulfuros.","[parsan.biz](https://www.parsan.biz), [gaiaexploracion.com](https://www.gaiaexploracion.com), [austhaigeophysics.com](https://www.austhaigeophysics.com), [epa.gov](https://www.epa.gov)","Monitoreo y Detección","Técnica geofísica que mide la cargabilidad eléctrica del subsuelo, útil para detectar minerales sulfurosos y arcillas asociadas a contaminación."
"Potencial Espontáneo (SP)","Métodos Geofísicos","Método pasivo que mide diferencias de potencial eléctrico natural por flujo de agua o reacciones electroquímicas. [81, 91, 92]","Detección fugas en presas, trazado flujo subsuperficial, monitoreo plumas conductoras..[81, 91, 92, 93] Flujo entrada: potencial negativo; salida: positivo..[91] SUMO Services ofrece SP..[93] La conversión de datos geofísicos a parámetros directos es compleja y requiere calibración..[83]","Perfil de SP sobre presa mostrando anomalía de fuga.","[parsan.biz](https://www.parsan.biz), [epa.gov](https://www.epa.gov), [clu-in.org](https://clu-in.org), [sumoservices.com](https://www.sumoservices.com)","Monitoreo y Detección","Técnica geofísica pasiva que mide los potenciales eléctricos naturales en el subsuelo para detectar flujos de agua (infiltraciones)."
"Métodos Electromagnéticos (EM)","Métodos Geofísicos","Inducción de corrientes eléctricas para mapear variaciones conductividad. FDEM o TDEM. [94, 95]","Aplicaciones: mapeo suelos, geología, fallas, plumas contaminantes, filtraciones, objetos metálicos..[94] Profundidad: metros a 1000 m..[94] EM Aerotransportados (AEM) para áreas remotas..[94, 95] EMC Geographic Services y TEMcompany (sTEM) ofrecen equipos/servicios..[96, 97]","Mapa de conductividad del subsuelo por EM.","[clu-in.org](https://clu-in.org), [water.ca.gov](https://water.ca.gov), [emcgeophysics.com](https://www.emcgeophysics.com), [temcompany.com](https://www.temcompany.com)","Monitoreo y Detección","Técnicas geofísicas que utilizan campos electromagnéticos para investigar las propiedades eléctricas del subsuelo y detectar anomalías."
"Georradar (GPR)","Métodos Geofísicos","Pulsos de ondas de radio de alta frecuencia para imágenes subsuelo somero (<10 m). [98, 99]","Identifica estructuras subsuperficiales, vacíos, capas suelo, integridad hormigón, contaminantes..[98] Ventajas: no destructivo, alta resolución, versátil, tiempo real..[98] Mapeo geología somera, vertederos, fugas, tanques enterrados..[98, 99] ECS Limited ofrece GPR..[100]","Radargrama mostrando anomalía subsuperficial.","[mfe-is.com](https://www.mfe-is.com), [fendergeophysics.com.au](https://www.fendergeophysics.com.au), [ecslimited.com](https://www.ecslimited.com), [epa.gov](https://www.epa.gov)","Monitoreo y Detección","Técnica geofísica que utiliza ondas de radio para obtener imágenes de alta resolución del subsuelo somero, útil para detectar fugas y objetos enterrados."
"Redes de Sensores Inalámbricos (WSN) y Plataformas IoT","Monitoreo Basado en Sensores","Sensores interconectados (piezómetros, inclinómetros, etc.) transmiten datos inalámbricamente a plataforma centralizada. [101, 102, 103, 104]","Mejoran conocimiento mecanismos falla, detectan riesgos, diseñan expansiones, establecen respuestas emergencia..[101] Datos vía nodos/gateway a software visualización..[101] Mining3 (sensores presión/flujo agua)..[102] Viasat Tailings Insight (nube, satélite L-band, LoRaWAN)..[103] DAARWIN (SAALG Geomechanics, gemelos digitales)..[104] Worldsensing, sensemetrics (Bentley) son proveedores..[105, 106]","Panel de control plataforma IoT con datos de presa.","[geosense.com](https://www.geosense.com), [mining3.com](https://www.mining3.com), [viasat.com](https://www.viasat.com), [waterpowermagazine.com](https://www.waterpowermagazine.com), [worldsensing.com](https://www.worldsensing.com), [infrastructureiot.com](https://www.infrastructureiot.com)","Monitoreo y Detección","Sistemas de múltiples sensores distribuidos en el sitio que recopilan y transmiten datos en tiempo real para el monitoreo remoto de presas de relaves."
